Frame 10: 139 bytes on wire (1112 bits), 139 bytes captured (1112 bits) on interface wlp2s0, id 0
Ethernet II, Src: DWnetTec_7c:d9:20 (f8:aa:3f:7c:d9:20), Dst: LiteonTe_2c:09:77 (3c:91:80:2c:09:77)
Internet Protocol Version 4, Src: 216.239.36.21, Dst: 192.168.0.20
Transmission Control Protocol, Src Port: 443, Dst Port: 39412, Seq: 1, Ack: 1, Len: 73
Transport Layer Security

Frame 20: 1292 bytes on wire (10336 bits), 1292 bytes captured (10336 bits) on interface wlp2s0, id 0
Ethernet II, Src: LiteonTe_2c:09:77 (3c:91:80:2c:09:77), Dst: DWnetTec_7c:d9:20 (f8:aa:3f:7c:d9:20)
Internet Protocol Version 4, Src: 192.168.0.20, Dst: 142.250.178.174
User Datagram Protocol, Src Port: 49218, Dst Port: 443
QUIC IETF
QUIC IETF

Frame 30: 67 bytes on wire (536 bits), 67 bytes captured (536 bits) on interface wlp2s0, id 0
Ethernet II, Src: DWnetTec_7c:d9:20 (f8:aa:3f:7c:d9:20), Dst: LiteonTe_2c:09:77 (3c:91:80:2c:09:77)
Internet Protocol Version 4, Src: 142.250.178.174, Dst: 192.168.0.20
User Datagram Protocol, Src Port: 443, Dst Port: 49218
QUIC IETF
